{
  "schemaVersion": 1,
  "catalogVersion": 1,
  "updatedAt": "2026-10-15",
  "featured": [
    "claude_code",
    "chatgpt",
    "anthropic",
    "openai",
    "deepseek",
    "qwen"
  ],
  "providers": [
    {
      "id": "chatgpt",
      "name": "ChatGPT",
      "mark": "GP",
      "hue": 165,
      "aliases": [
        "openai",
        "codex",
        "gpt",
        "subscription"
      ],
      "description": "Use your ChatGPT Plus, Pro or Business plan",
      "auth": "signin",
      "adapter": "openai_codex",
      "fields": [],
      "billedBy": "Your ChatGPT plan",
      "allowCustomModel": true,
      "models": [
        {
          "id": "gpt-6.1-sol",
          "name": "GPT-6.1 Sol",
          "description": "Best for most work",
          "recommended": true,
          "contextWindow": 1050000,
          "vision": true,
          "thinking": {
            "standard": {
              "thinking_enabled": true,
              "thinking_strength": "medium"
            },
            "deep": {
              "thinking_enabled": true,
              "thinking_strength": "high"
            }
          }
        },
        {
          "id": "gpt-6-astra",
          "name": "GPT-6 Astra",
          "description": "Most capable, slower",
          "contextWindow": 1050000,
          "vision": true,
          "thinking": {
            "standard": {
              "thinking_enabled": true,
              "thinking_strength": "medium"
            },
            "deep": {
              "thinking_enabled": true,
              "thinking_strength": "high"
            }
          }
        },
        {
          "id": "gpt-6-luna",
          "name": "GPT-6 Luna",
          "description": "Fast and focused",
          "quick": true,
          "contextWindow": 1050000,
          "vision": true,
          "thinking": {
            "off": {
              "thinking_enabled": false
            },
            "standard": {
              "thinking_enabled": true,
              "thinking_strength": "medium"
            },
            "deep": {
              "thinking_enabled": true,
              "thinking_strength": "high"
            }
          }
        },
        {
          "id": "gpt-5.5",
          "name": "GPT-5.5",
          "description": "Retired from ChatGPT sign-in",
          "retired": true,
          "replacement": "gpt-6.1-sol",
          "hidden": true
        }
      ]
    },
    {
      "id": "claude_code",
      "name": "Claude",
      "mark": "Cl",
      "hue": 40,
      "aliases": [
        "anthropic",
        "claude code",
        "subscription",
        "max",
        "pro"
      ],
      "description": "Use your Claude Pro or Max plan through Claude Code",
      "auth": "signin",
      "adapter": "claude_cli",
      "fields": [],
      "billedBy": "Your Claude plan",
      "allowCustomModel": true,
      "models": [
        {
          "id": "opus",
          "name": "Opus (latest)",
          "description": "Best for complex work",
          "recommended": true,
          "contextWindow": 1000000,
          "vision": true,
          "thinking": {
            "standard": {
              "thinking_enabled": true,
              "thinking_strength": "medium"
            },
            "deep": {
              "thinking_enabled": true,
              "thinking_strength": "high"
            }
          }
        },
        {
          "id": "sonnet",
          "name": "Sonnet (latest)",
          "description": "Fast everyday work",
          "contextWindow": 1000000,
          "vision": true,
          "thinking": {
            "standard": {
              "thinking_enabled": true,
              "thinking_strength": "medium"
            },
            "deep": {
              "thinking_enabled": true,
              "thinking_strength": "high"
            }
          }
        },
        {
          "id": "haiku",
          "name": "Haiku (latest)",
          "description": "Fastest for simple tasks",
          "quick": true,
          "contextWindow": 1000000,
          "vision": true,
          "thinking": {
            "standard": {
              "thinking_enabled": true,
              "thinking_strength": "medium"
            },
            "deep": {
              "thinking_enabled": true,
              "thinking_strength": "high"
            }
          }
        },
        {
          "id": "fable",
          "name": "Fable",
          "description": "Hardest, longest-running tasks",
          "contextWindow": 1000000,
          "vision": true,
          "thinking": {
            "standard": {
              "thinking_enabled": true,
              "thinking_strength": "medium"
            },
            "deep": {
              "thinking_enabled": true,
              "thinking_strength": "high"
            }
          }
        }
      ]
    },
    {
      "id": "anthropic",
      "name": "Anthropic API",
      "mark": "A",
      "hue": 40,
      "aliases": [
        "claude"
      ],
      "description": "Claude models, billed per use",
      "auth": "api_key",
      "adapter": "anthropic",
      "fields": [
        {
          "key": "api_key",
          "kind": "secret",
          "label": "API key",
          "required": true,
          "placeholder": "sk-ant-…"
        }
      ],
      "keyHelp": {
        "url": "https://platform.claude.com/settings/keys",
        "steps": [
          "Sign in to the Claude Console",
          "Open Settings → API keys and click Create key",
          "Copy the key; it is shown only once"
        ]
      },
      "billedBy": "Anthropic",
      "allowCustomModel": true,
      "models": [
        {
          "id": "claude-opus-5-5",
          "name": "Claude Opus 5.5",
          "description": "Best for complex work",
          "recommended": true,
          "contextWindow": 1000000,
          "vision": true,
          "thinking": {
            "standard": {
              "thinking_enabled": true,
              "thinking_strength": "medium"
            },
            "deep": {
              "thinking_enabled": true,
              "thinking_strength": "high"
            }
          }
        },
        {
          "id": "claude-sonnet-5-5",
          "name": "Claude Sonnet 5.5",
          "description": "Fast and smart, everyday work",
          "contextWindow": 1000000,
          "vision": true,
          "thinking": {
            "off": {
              "thinking_enabled": false
            },
            "standard": {
              "thinking_enabled": true,
              "thinking_strength": "medium"
            },
            "deep": {
              "thinking_enabled": true,
              "thinking_strength": "high"
            }
          }
        },
        {
          "id": "claude-haiku-5-5",
          "name": "Claude Haiku 5.5",
          "description": "Fastest and lowest cost",
          "quick": true,
          "contextWindow": 1000000,
          "vision": true,
          "thinking": {
            "off": {
              "thinking_enabled": false
            },
            "standard": {
              "thinking_enabled": true,
              "thinking_strength": "medium"
            },
            "deep": {
              "thinking_enabled": true,
              "thinking_strength": "high"
            }
          }
        },
        {
          "id": "claude-fable-5-1",
          "name": "Claude Fable 5.1",
          "description": "Hardest reasoning, long tasks",
          "contextWindow": 1000000,
          "vision": true,
          "thinking": {
            "standard": {
              "thinking_enabled": true,
              "thinking_strength": "medium"
            },
            "deep": {
              "thinking_enabled": true,
              "thinking_strength": "high"
            }
          }
        }
      ]
    },
    {
      "id": "openai",
      "name": "OpenAI API",
      "mark": "O",
      "hue": 165,
      "aliases": [
        "gpt",
        "chatgpt"
      ],
      "description": "GPT models, billed per use",
      "auth": "api_key",
      "adapter": "openai_responses",
      "fields": [
        {
          "key": "api_key",
          "kind": "secret",
          "label": "API key",
          "required": true,
          "placeholder": "sk-…"
        }
      ],
      "keyHelp": {
        "url": "https://platform.openai.com/api-keys",
        "steps": [
          "Sign in to the OpenAI Platform",
          "Open API keys and click Create new secret key",
          "Copy the key; add billing credit if asked"
        ]
      },
      "billedBy": "OpenAI",
      "allowCustomModel": true,
      "models": [
        {
          "id": "gpt-6.1-sol",
          "name": "GPT-6.1 Sol",
          "description": "Best balance of smarts and cost",
          "recommended": true,
          "contextWindow": 1050000,
          "vision": true,
          "thinking": {
            "standard": {
              "thinking_enabled": true,
              "thinking_strength": "medium"
            },
            "deep": {
              "thinking_enabled": true,
              "thinking_strength": "high"
            }
          }
        },
        {
          "id": "gpt-6-astra",
          "name": "GPT-6 Astra",
          "description": "Best for complex work",
          "contextWindow": 1050000,
          "vision": true,
          "thinking": {
            "standard": {
              "thinking_enabled": true,
              "thinking_strength": "medium"
            },
            "deep": {
              "thinking_enabled": true,
              "thinking_strength": "high"
            }
          }
        },
        {
          "id": "gpt-6-luna",
          "name": "GPT-6 Luna",
          "description": "Fast and low cost",
          "quick": true,
          "contextWindow": 1050000,
          "vision": true,
          "thinking": {
            "off": {
              "thinking_enabled": false
            },
            "standard": {
              "thinking_enabled": true,